keywords,year,_description,_height,_width,_time,_event,id
"文化Culture",2017,第一年影展,667,1200,1890,第一届上海酷儿影展,上海酷儿影展2017
"文化Culture",2018,oil on cardboard,292,640,1886,第二届上海酷儿影展,上海酷儿影展2018
"文化Culture",2019,oil on canvas,1000,1581,1887,第三届上海酷儿影展,上海酷儿影展2019
"文化Culture",2020,pencil on paper,966,1528,1884 - 1885,第四届上海酷儿影展,上海酷儿影展2020
"文化Culture",2021,开始征片但未能举办,740,988,1884 - 1885,第五届上海酷儿影展 未举办,上海酷儿影展2021
"文化Culture",2011,oil on canvas,9150,7200,1888,The Yellow House (The Street),e9388d8a-4140-4cc5-a4cd-f126ad58b012
"教育Education",2008,2008年教育部发布《中小学健康教育指导纲要》涵盖bablalabla,680,2018,2008,2008年教育部发布《中小学健康教育指导纲要》,中小学健康教育指导纲要